{
  "$schema": "./progress.schema.json",
  "project": {
    "name": "lumi",
    "display_name": "Lumi",
    "subtitle": "Lumi — Volleyball Scouting",
    "bundle_identifier": "com.muramoto-co.lumi",
    "naming_origin": "フランス語 lumière（光）に由来。データに光を当て、試合の本質を映し出す意図。",
    "version": "0.2.4",
    "started_at": "2026-05-02",
    "current_phase": "2.4"
  },
  "current_milestone": {
    "id": "All-Phases",
    "name": "Phase 1.0 ~ 2.4 のコア API/モデル/PDF/テスト まで一気通貫実装",
    "status": "completed",
    "started_at": "2026-05-03",
    "estimated_completion": "2026-05-05",
    "completion_percentage": 100
  },
  "milestones": [
    {
      "id": "M0",
      "name": "プロジェクト基盤",
      "status": "completed",
      "started_at": "2026-05-03",
      "completed_at": "2026-05-03T12:00:00+09:00",
      "tasks": [
        { "id": "M0-T1", "name": "Xcodeプロジェクト初期化", "status": "completed", "completed_at": "2026-05-03T00:00:00+09:00", "notes": "ユーザーが手動でXcode新規プロジェクト作成。Bundle ID: com.muramoto-co.lumi、iPad横画面のみ対応" },
        { "id": "M0-T2", "name": "SPMマルチモジュール構成", "status": "completed", "completed_at": "2026-05-03T12:00:00+09:00", "notes": "Package.swift作成、18モジュール定義、Xcodeプロジェクト統合" },
        { "id": "M0-T3", "name": "TCAセットアップ", "status": "completed", "completed_at": "2026-05-03T12:00:00+09:00", "notes": "TCA 1.25.5、AppFeature Reducer + AppView実装" },
        { "id": "M0-T4", "name": "Supabaseクライアント初期化", "status": "completed", "completed_at": "2026-05-03T12:00:00+09:00", "notes": "supabase-swift 2.46.0、AppConfig + SupabaseClientProvider" },
        { "id": "M0-T5", "name": "DesignSystemモジュール骨格", "status": "completed", "completed_at": "2026-05-03T12:00:00+09:00", "notes": "Colors.swift（信号機メタファー4色+UI色）、Typography.swift（SF Pro Rounded/Display/Mono）" },
        { "id": "M0-T6", "name": "GitHub Actions CI セットアップ", "status": "completed", "completed_at": "2026-05-03T12:00:00+09:00", "notes": ".github/workflows/ci.yml作成" },
        { "id": "M0-T7", "name": "Sentry SDK 統合", "status": "completed", "completed_at": "2026-05-03T12:00:00+09:00", "notes": "sentry-cocoa 8.58.2、TelemetryBootstrap + OSLog Logger" },
        { "id": "M0-T8", "name": "String Catalog 基盤", "status": "completed", "completed_at": "2026-05-03T12:00:00+09:00", "notes": "Localizable.xcstrings作成、ja/en対応、sourceLanguage=ja" }
      ]
    },
    {
      "id": "M1",
      "name": "チーム・試合・サービス順",
      "status": "completed",
      "started_at": "2026-05-04",
      "completed_at": "2026-05-04T20:00:00+09:00",
      "tasks": [
        { "id": "M1-T1", "name": "Team/Player モデル定義", "status": "completed", "completed_at": "2026-05-04T19:00:00+09:00", "notes": "純粋Swift値型 (Codable/Equatable/Hashable/Sendable)" },
        { "id": "M1-T2", "name": "Match/Set/MatchMember モデル定義", "status": "completed", "completed_at": "2026-05-04T19:00:00+09:00", "notes": "Match/MatchSet/MatchMember/ServiceOrderEntry/Substitution/Rally" },
        { "id": "M1-T3", "name": "ServiceOrderEngine ロジック実装", "status": "completed", "completed_at": "2026-05-04T19:30:00+09:00", "notes": "currentServer/initializeForNewSet/advance/substitute/canSubstituteAgain (純粋関数)" },
        { "id": "M1-T4", "name": "選手交代時の順番引継ぎロジック", "status": "completed", "completed_at": "2026-05-04T19:30:00+09:00", "notes": "1回最大3人・1セット最大4回・currentPlayerId 更新" },
        { "id": "M1-T5", "name": "再交代制限ロジック", "status": "completed", "completed_at": "2026-05-04T19:30:00+09:00", "notes": "同 ServiceOrderEntry に対する Substitution が 2 件まで (先発↔交代の往復可)" },
        { "id": "M1-T6", "name": "セット間引き継ぎロジック", "status": "completed", "completed_at": "2026-05-04T19:30:00+09:00", "notes": "前セット最終 own サーブ order の次から (1〜9 でラップ)" },
        { "id": "M1-T7", "name": "TeamManagementFeature（選手15人マスタ）", "status": "completed", "completed_at": "2026-05-04T19:45:00+09:00", "notes": "TCA Reducer + SwiftUI View、選手追加/編集/削除、最大15人" },
        { "id": "M1-T8", "name": "MatchSetupFeature（試合作成）", "status": "completed", "completed_at": "2026-05-04T20:00:00+09:00", "notes": "TCA Reducer + Form View、9人スタメン選択、サービス順並び替え、フォーメーション選択" },
        { "id": "M1-T9", "name": "前回スタメンコピー機能", "status": "completed", "completed_at": "2026-05-04T20:00:00+09:00", "notes": "fetchLastMatch + lineupCopied アクションで反映" },
        { "id": "M1-T10", "name": "ServiceOrderEngineTests（厚く）", "status": "completed", "completed_at": "2026-05-04T19:30:00+09:00", "notes": "19テスト 5スイート 全緑 (初期化/advance/セット遷移/交代/再交代)" }
      ]
    },
    {
      "id": "M2",
      "name": "入力UI コア",
      "status": "completed",
      "started_at": "2026-05-04",
      "completed_at": "2026-05-04T21:00:00+09:00",
      "tasks": [
        { "id": "M2-T1", "name": "Rally/Play モデル定義", "status": "completed", "completed_at": "2026-05-04T20:30:00+09:00", "notes": "Play/PlayType/Evaluation/ServeType/AttackCourse/CourtZone等。Rally に plays、MatchSet に rallies/timeouts 追加" },
        { "id": "M2-T2", "name": "RallyTimelineモジュール", "status": "completed", "completed_at": "2026-05-04T20:40:00+09:00", "notes": "append/remove/move/endRally/computeAssists 純粋関数。10テスト全緑" },
        { "id": "M2-T3", "name": "MatchInputFeature 骨格", "status": "completed", "completed_at": "2026-05-04T21:00:00+09:00", "notes": "State + 主要 Action + Reducer。9テスト全緑" },
        { "id": "M2-T4", "name": "コートタップUI", "status": "completed", "completed_at": "2026-05-04T21:00:00+09:00", "notes": "自陣・相手陣 3x3 グリッド (CourtGrid)" },
        { "id": "M2-T5", "name": "選手選択UI", "status": "completed", "completed_at": "2026-05-04T21:00:00+09:00", "notes": "自/相手切替で player/jersey 入力" },
        { "id": "M2-T6", "name": "プレー種別ボタン群", "status": "completed", "completed_at": "2026-05-04T21:00:00+09:00", "notes": "7種ボタン (サーブ/レセプ/セット/アタック/ブロック/ディグ/ミス)" },
        { "id": "M2-T7", "name": "評価4段階ボタン（信号機メタファー）", "status": "completed", "completed_at": "2026-05-04T21:00:00+09:00", "notes": "◎緑/○シアン/△黄/×赤、SF Symbols + symbol、sensoryFeedback 連携" },
        { "id": "M2-T8", "name": "ラリータイムライン表示", "status": "completed", "completed_at": "2026-05-04T21:00:00+09:00", "notes": "現在ラリーの Play 横スクロール、PlayCard コンポーネント" },
        { "id": "M2-T9", "name": "クイックモード", "status": "completed", "completed_at": "2026-05-04T21:00:00+09:00", "notes": "PlayType + Evaluation + (Player or Jersey) のみ" },
        { "id": "M2-T10", "name": "スタンダードモード", "status": "completed", "completed_at": "2026-05-04T21:00:00+09:00", "notes": "+ ServeType / ReceptionQuality" },
        { "id": "M2-T11", "name": "詳細モード", "status": "completed", "completed_at": "2026-05-04T21:00:00+09:00", "notes": "+ AttackCourse / CourtZone" },
        { "id": "M2-T12", "name": "アンドゥロジック（5ステップ）", "status": "completed", "completed_at": "2026-05-04T21:00:00+09:00", "notes": "stateHistory FIFO 5件、commitPlay/endRally/timeout/sub で push" },
        { "id": "M2-T13", "name": "直前ラリー編集UI", "status": "completed", "completed_at": "2026-05-04T21:00:00+09:00", "notes": "現在未終了ラリーのプレー一覧表示。完了済みラリー編集は M3 以降で拡張" },
        { "id": "M2-T14", "name": "自/相手切替", "status": "completed", "completed_at": "2026-05-04T21:00:00+09:00", "notes": "Picker(.segmented) で 1タップ切替。teamSwitched でドラフトクリア" },
        { "id": "M2-T15", "name": "タイムアウト入力", "status": "completed", "completed_at": "2026-05-04T21:00:00+09:00", "notes": "TimeoutSheet、自/相手 1セット2回上限、3回目はエラー" },
        { "id": "M2-T16", "name": "選手交代入力", "status": "completed", "completed_at": "2026-05-04T21:00:00+09:00", "notes": "SubstitutionSheet、ServiceOrderEngine.substitute 経由でバリデーション (4回/3人/再交代)" },
        { "id": "M2-T17", "name": "Hapticフィードバック", "status": "completed", "completed_at": "2026-05-04T21:00:00+09:00", "notes": "iOS 26 SensoryFeedback API。評価別 (success/light/selection/warning)" }
      ]
    },
    {
      "id": "M3",
      "name": "KPI計算・リアルタイム表示",
      "status": "completed",
      "started_at": "2026-05-04",
      "completed_at": "2026-05-04T22:00:00+09:00",
      "tasks": [
        { "id": "M3-T1", "name": "StatsEngine（アタック決定率/効果率）", "status": "completed", "completed_at": "2026-05-04T21:30:00+09:00", "notes": "Data Volley準拠、attempts==0で0.0返却" },
        { "id": "M3-T2", "name": "StatsEngine（レセプション）", "status": "completed", "completed_at": "2026-05-04T21:30:00+09:00", "notes": "A率・返球率(A+B+C)" },
        { "id": "M3-T3", "name": "StatsEngine（サーブ統計）", "status": "completed", "completed_at": "2026-05-04T21:30:00+09:00", "notes": "エース・ミス・効率" },
        { "id": "M3-T4", "name": "StatsEngine（ブロック・ディグ・セット）", "status": "completed", "completed_at": "2026-05-04T21:30:00+09:00", "notes": "総数・blockKills(excellent)・assists" },
        { "id": "M3-T5", "name": "アシスト自動計算", "status": "completed", "completed_at": "2026-05-04T21:30:00+09:00", "notes": "RallyTimeline.computeAssists で実装済み (M2)。集計時に isAssist=true をカウント" },
        { "id": "M3-T6", "name": "連続得点判定（3点以上ハイライト）", "status": "completed", "completed_at": "2026-05-04T21:30:00+09:00", "notes": "consecutiveRuns 純粋関数。winner切替で run 区切り" },
        { "id": "M3-T7", "name": "MatchViewerFeature 骨格", "status": "completed", "completed_at": "2026-05-04T22:00:00+09:00", "notes": "TCA Reducer + recompute Effect。statsScope/playerSelected/matchUpdated で再計算" },
        { "id": "M3-T8", "name": "KPI ダッシュボードUI", "status": "completed", "completed_at": "2026-05-04T22:00:00+09:00", "notes": "自/相手2列、Tabular Numbers、信号機メタファー色" },
        { "id": "M3-T9", "name": "得点推移グラフ（TOマーカー含む）", "status": "completed", "completed_at": "2026-05-04T22:00:00+09:00", "notes": "Swift Charts、自/相手LineMark、TO PointMark、連続得点RectangleMark" },
        { "id": "M3-T10", "name": "選手別/セット別/フォーメーション別フィルタ", "status": "completed", "completed_at": "2026-05-04T22:00:00+09:00", "notes": "Picker(.segmented) でセット別、Menu で選手別" },
        { "id": "M3-T11", "name": "StatsEngineTests（90%カバレッジ）", "status": "completed", "completed_at": "2026-05-04T21:30:00+09:00", "notes": "14テスト 7スイート 全緑。0打数/1打数/混合/scope/連続/選手別をカバー" }
      ]
    },
    {
      "id": "M4",
      "name": "同期・認証",
      "status": "completed",
      "started_at": "2026-05-04",
      "completed_at": "2026-05-04T23:00:00+09:00",
      "tasks": [